{
  "name": "@agileflow/interviewing-requirements",
  "version": "1.0.2",
  "integrity": "sha256-uaxjuI8DKtZgxQAXvozADFTK50A7frGN+wglZWVHuRY=",
  "url": "packages/@agileflow/interviewing-requirements/1.0.2.json",
  "metadata": {
    "description": "Interview the user in small rounds of high-value questions to pin down requirements and stress-test a plan before implementation, after first checking the repository for facts it can answer. Use only when the user explicitly asks to be interviewed, questioned, or grilled about a plan, or says things like \"ask me questions\", \"stress-test this plan\", \"help me decide by asking me questions\", or \"question me about this\". Do not activate for ordinary implementation requests.",
    "activation": "manual",
    "files": 7,
    "references": [],
    "scripts": [],
    "requirements": {
      "commands": [],
      "network": "none"
    }
  },
  "compatibility": {
    "agentSkills": true,
    "bundleFormat": 1
  }
}
