{
  "name": "@agileflow/filing-pr",
  "version": "1.2.0",
  "integrity": "sha256-BBcnGHApD0cbTB78Uh3Hdn8GX3okhSxx4AiU+k6GjgI=",
  "url": "packages/@agileflow/filing-pr/1.2.0.json",
  "metadata": {
    "description": "Open a pull request for the current branch with a title that follows repository conventions and a description that leads with the problem, summarizes the solution, and includes verification evidence, then return the PR URL. Use when the user asks to file, open, create, raise, or submit a pull request (PR). Not for reviewing an existing PR or monitoring one through CI.",
    "activation": "auto",
    "files": 7,
    "references": [],
    "scripts": [],
    "requirements": {
      "commands": [
        "git",
        "gh"
      ],
      "network": "required"
    }
  },
  "compatibility": {
    "agentSkills": true,
    "bundleFormat": 1
  }
}
