{
  "name": "@agileflow/diagnosing-bugs",
  "version": "1.0.2",
  "integrity": "sha256-7vpsFKUip7MPEYbSqhRtVgPFd72W3DcoBPJMcWgKj78=",
  "url": "packages/@agileflow/diagnosing-bugs/1.0.2.json",
  "metadata": {
    "description": "Diagnose and fix reproducible defects, regressions, failing tests, crashes, and unexpected behavior by reproducing, isolating the root cause, and making the smallest fix that explains the evidence. Use when the user reports something broken, a test or build is failing, behavior changed unexpectedly, or they ask for root-cause analysis. Do not use for general conceptual questions or new feature work.",
    "activation": "auto",
    "files": 8,
    "references": [],
    "scripts": [],
    "requirements": {
      "commands": [],
      "network": "none"
    }
  },
  "compatibility": {
    "agentSkills": true,
    "bundleFormat": 1
  }
}
