{
  "name": "@agileflow/creating-epics",
  "version": "1.0.1",
  "integrity": "sha256-hINvQFPRrSeGaGXn1I9WreNASbRhY5e2WLN7xXaVzuU=",
  "url": "packages/@agileflow/creating-epics/1.0.1.json",
  "metadata": {
    "description": "Create or refine an AgileFlow Work epic, one outcome-level body of work with its problem, outcome, scope, non-goals, and success signals. Use when the user asks to create, draft, or refine an epic, or to frame a multi-story initiative or roadmap item as an epic. Not for splitting an epic into stories, writing a single story, implementing work, or explaining what an epic is.",
    "activation": "auto",
    "files": 6,
    "references": [],
    "scripts": [],
    "requirements": {
      "commands": [],
      "network": "none"
    }
  },
  "compatibility": {
    "agentSkills": true,
    "bundleFormat": 1
  }
}
