{
  "name": "@agileflow/diagnosing-bugs",
  "version": "1.0.4",
  "integrity": "sha256-b9vNyHSZyMh7shuu/UUpYj7RfpTvoF2LBXqPp9jwGbw=",
  "url": "packages/@agileflow/diagnosing-bugs/1.0.4.json",
  "metadata": {
    "description": "Diagnose and fix reproducible defects, regressions, failing tests, crashes, and unexpected behavior by reproducing, isolating the root cause, and making the smallest fix that explains the evidence. Use when the user reports something broken, a test or build is failing, behavior changed unexpectedly, or they ask for root-cause analysis. Not for confirming that a change just made works (verifying-changes), writing tests for code that works (writing-tests), general conceptual questions, or new feature work.",
    "activation": "auto",
    "files": 10,
    "references": [],
    "scripts": [],
    "requirements": {
      "commands": [],
      "network": "none"
    }
  },
  "compatibility": {
    "agentSkills": true,
    "bundleFormat": 1
  }
}
